{
  "handle": "yu7dan",
  "name": "Yu7dan",
  "github": "lant1ng-1216",
  "avatar": null,
  "tagline": "喜欢把想到的东西做出来",
  "bio": "先做出来，再谈别的。做过链上协议、手写模拟器、行业小工具——AI 与工具类的小项目为主，作品陆续摆上台。",
  "tags": ["Vibe Coding", "AI", "Solana"],
  "links": [{ "label": "GitHub", "href": "https://github.com/lant1ng-1216" }],
  "sync": {
    "mode": "all",
    "includeRepos": [],
    "excludeRepos": ["vibe-lab"]
  }
}
